{
  "schema": "nogra.anchor.v1",
  "anchorId": "anchor-000001-7b119dff5be1",
  "workspaceId": "example-workspace",
  "createdAt": "2026-07-23T10:00:00.000Z",
  "updatedAt": "2026-07-23T10:00:00.000Z",
  "sourceWatermark": 1,
  "contentHash": "sha256:7b119dff5be15b59f4c3bec8563b3916d24fee6da1d1b2bb35c6c281c0529398",
  "supersedes": null,
  "authority": {
    "mode": "observation",
    "objective": "Preserve the verified continuity state.",
    "scope": {
      "in": [
        "Local Nogra records and repository state."
      ],
      "out": [
        "No dispatch or external mutation."
      ]
    },
    "briefId": null,
    "briefHash": null,
    "approvalId": null,
    "approvalActionHash": null
  },
  "completion": {
    "verifiedDone": [],
    "claimedDone": [],
    "unknown": [
      {
        "itemId": "unknown-example",
        "subject": "Production deployment state",
        "reason": "No deployment receipt was supplied.",
        "nextCheck": "Inspect a canonical deployment receipt.",
        "sourceRef": "operator:example"
      }
    ]
  },
  "decisions": [],
  "blockers": [],
  "nextOwner": "Manager",
  "git": {
    "status": "unknown",
    "commit": null,
    "branch": "",
    "dirtyCount": null,
    "dirtyFingerprint": null,
    "fingerprintBasis": "",
    "source": "git read-only snapshot unavailable"
  },
  "references": {
    "briefIds": [],
    "approvalIds": [],
    "runIds": [],
    "factIds": [],
    "evidenceRefs": [],
    "verdictIds": []
  },
  "native": {
    "platform": "claude_code",
    "sessionId": "",
    "transcriptId": "",
    "checkpointRef": null
  },
  "redactions": [],
  "metadata": {
    "projection": ".nogra/state/SESSION-CHECKPOINT.md"
  }
}
