{
  "schema": "nogra.anchor.v1",
  "anchorId": "anchor-000001-8d328925ebba",
  "workspaceId": "fixture-workspace",
  "createdAt": "2026-07-23T10:00:00.000Z",
  "updatedAt": "2026-07-23T10:00:00.000Z",
  "sourceWatermark": 1,
  "contentHash": "sha256:8d328925ebba83c1da1065425885f50e503524339d12f691c8ec62be9f61359c",
  "supersedes": null,
  "authority": {
    "mode": "observation",
    "objective": "Preserve the fixture continuity state.",
    "scope": {
      "in": [
        "Fixture-local Nogra records."
      ],
      "out": [
        "No external state."
      ]
    },
    "briefId": null,
    "briefHash": null,
    "approvalId": null,
    "approvalActionHash": null
  },
  "completion": {
    "verifiedDone": [],
    "claimedDone": [],
    "unknown": [
      {
        "itemId": "unknown-deploy",
        "subject": "Deployment state",
        "reason": "No deployment receipt exists.",
        "nextCheck": "Provide a deployment receipt.",
        "sourceRef": "fixture:operator"
      }
    ]
  },
  "decisions": [],
  "blockers": [],
  "nextOwner": "Manager",
  "git": {
    "status": "unknown",
    "commit": null,
    "branch": "",
    "dirtyCount": null,
    "dirtyFingerprint": null,
    "fingerprintBasis": "",
    "source": "git read-only snapshot unavailable"
  },
  "references": {
    "briefIds": [],
    "approvalIds": [],
    "runIds": [],
    "factIds": [],
    "evidenceRefs": [],
    "verdictIds": []
  },
  "native": {
    "platform": "claude_code",
    "sessionId": "session-fixture",
    "transcriptId": "transcript-fixture",
    "checkpointRef": null
  },
  "redactions": [],
  "metadata": {
    "projection": ".nogra/state/SESSION-CHECKPOINT.md"
  }
}
